{
  "schema_version": "1.0.0",
  "updated": "2026-10-18",
  "depth_definitions": {
    "conceptual": "Qualitative or theoretical statement without an executable persistent update.",
    "external_optimization": "A fixed optimizer improves an external target.",
    "adaptation": "The system learns or searches for current or future tasks under a fixed update procedure.",
    "persistent": "A versioned modification survives into later tasks.",
    "transfer": "A persistent modification is reported to improve untouched tasks, models, or environments.",
    "multi_generation": "Several successor generations or lineage steps are reported.",
    "one_round_coevolution": "Model–harness interaction is demonstrated for one full build/update/rebuild round.",
    "recursive_theory": "A formal result concerns improvement of the self-modifying procedure.",
    "evaluation": "The work primarily evaluates, audits, or bounds self-improvement claims."
  },
  "evidence_definitions": {
    "reported": "Stated by the original authors or repository.",
    "reproduced": "Public artifacts were rerun with materially matching results.",
    "replicated": "An independent implementation supports the same conclusion.",
    "contradicted": "A controlled result conflicts with the claim.",
    "open": "Available evidence does not decide the claim."
  },
  "works": [
    {
      "id": "good-1965",
      "name": "Speculations Concerning the First Ultraintelligent Machine",
      "year": 1965,
      "role": "theory",
      "reported_depth": "conceptual",
      "changed_objects": [],
      "evidence_status": "reported",
      "audit_status": "pending",
      "central_limit": "Qualitative positive-feedback argument; no operational update process or empirical test.",
      "sources": [
        {
          "type": "paper",
          "url": "https://doi.org/10.1016/S0065-2458(08)60418-0"
        }
      ]
    },
    {
      "id": "eurisko",
      "name": "EURISKO",
      "year": 1983,
      "role": "historical_self_modification",
      "reported_depth": "persistent",
      "changed_objects": [
        "heuristics",
        "meta_heuristics"
      ],
      "evidence_status": "reported",
      "audit_status": "pending",
      "central_limit": "Bounded hand-engineered representations, incomplete modern reproduction, and no evidence of scalable general recursion.",
      "sources": [
        {
          "type": "paper",
          "url": "https://www.cs.northwestern.edu/~mek802/papers/not-mine/Lenat_EURISKO.pdf"
        }
      ]
    },
    {
      "id": "godel-machine",
      "name": "Gödel Machine",
      "year": 2003,
      "role": "formal_rsi",
      "reported_depth": "recursive_theory",
      "changed_objects": [
        "program",
        "proof_searcher"
      ],
      "evidence_status": "reported",
      "audit_status": "pending",
      "central_limit": "Useful self-rewrites must be provable in the encoded axiomatic system; proof search is not shown tractable for modern AI.",
      "sources": [
        {
          "type": "paper",
          "url": "https://arxiv.org/abs/cs/0309048"
        }
      ]
    },
    {
      "id": "maml",
      "name": "MAML",
      "year": 2017,
      "role": "precursor_meta_learning",
      "reported_depth": "adaptation",
      "changed_objects": [
        "model_parameters"
      ],
      "evidence_status": "reported",
      "audit_status": "pending",
      "central_limit": "Learns fast adaptation under a fixed human-designed meta-training algorithm; does not improve the improver.",
      "sources": [
        {
          "type": "paper",
          "url": "https://proceedings.mlr.press/v70/finn17a.html"
        }
      ]
    },
    {
      "id": "alphago-zero",
      "name": "AlphaGo Zero",
      "year": 2017,
      "role": "precursor_self_play",
      "reported_depth": "adaptation",
      "changed_objects": [
        "model_parameters"
      ],
      "evidence_status": "reported",
      "audit_status": "pending",
      "central_limit": "Powerful self-generated experience under exact rules and reward; update algorithm and objective remain fixed.",
      "sources": [
        {
          "type": "paper",
          "url": "https://www.nature.com/articles/nature24270"
        },
        {
          "type": "project_page",
          "url": "https://deepmind.google/blog/alphago-zero-starting-from-scratch/"
        }
      ]
    },
    {
      "id": "automl-zero",
      "name": "AutoML-Zero",
      "year": 2020,
      "role": "adjacent_algorithm_search",
      "reported_depth": "external_optimization",
      "changed_objects": [
        "learning_algorithm"
      ],
      "evidence_status": "reported",
      "audit_status": "pending",
      "central_limit": "Discovers target algorithms with a fixed outer evolutionary process; no successor-improver evidence.",
      "sources": [
        {
          "type": "paper",
          "url": "https://proceedings.mlr.press/v119/real20a.html"
        }
      ]
    },
    {
      "id": "stop",
      "name": "STOP",
      "year": 2023,
      "role": "direct_self_referential_improver",
      "reported_depth": "persistent",
      "changed_objects": [
        "improver_program"
      ],
      "evidence_status": "reported",
      "audit_status": "pending",
      "central_limit": "Underlying language model is fixed and evidence is bounded to the supplied task setting.",
      "sources": [
        {
          "type": "repository",
          "url": "https://github.com/microsoft/stop"
        },
        {
          "type": "paper",
          "url": "https://arxiv.org/abs/2310.02304"
        }
      ]
    },
    {
      "id": "promptbreeder",
      "name": "Promptbreeder",
      "year": 2023,
      "role": "direct_self_referential_prompt_search",
      "reported_depth": "persistent",
      "changed_objects": [
        "task_prompts",
        "mutation_prompts"
      ],
      "evidence_status": "reported",
      "audit_status": "pending",
      "central_limit": "Self-reference is prompt-level; broad transfer and successor-as-improver performance are not established.",
      "sources": [
        {
          "type": "paper",
          "url": "https://proceedings.mlr.press/v235/fernando24a.html"
        }
      ]
    },
    {
      "id": "funsearch",
      "name": "FunSearch",
      "year": 2024,
      "role": "adjacent_program_search",
      "reported_depth": "external_optimization",
      "changed_objects": [
        "target_program"
      ],
      "evidence_status": "reported",
      "audit_status": "pending",
      "central_limit": "Produces valuable external programs with a fixed model-search-evaluator process; does not improve the producing system.",
      "sources": [
        {
          "type": "paper",
          "url": "https://www.nature.com/articles/s41586-023-06924-6"
        },
        {
          "type": "repository",
          "url": "https://github.com/google-deepmind/funsearch"
        }
      ]
    },
    {
      "id": "spin",
      "name": "SPIN",
      "year": 2024,
      "role": "precursor_model_self_training",
      "reported_depth": "persistent",
      "changed_objects": [
        "model_weights",
        "self_generated_training_data"
      ],
      "evidence_status": "reported",
      "audit_status": "pending",
      "central_limit": "The iterative training rule is externally fixed; long-run diversity, retention, and recursive update quality remain open.",
      "sources": [
        {
          "type": "repository",
          "url": "https://github.com/uclaml/SPIN"
        },
        {
          "type": "paper",
          "url": "https://proceedings.mlr.press/v235/chen24j.html"
        }
      ]
    },
    {
      "id": "self-rewarding-lm",
      "name": "Self-Rewarding Language Models",
      "year": 2024,
      "role": "precursor_self_generated_reward",
      "reported_depth": "multi_generation",
      "changed_objects": [
        "model_weights",
        "self_generated_rewards"
      ],
      "evidence_status": "reported",
      "audit_status": "pending",
      "central_limit": "Three training iterations and better reward provision are author-reported; broad common-target improvement and independent replication remain to be audited.",
      "sources": [
        {
          "type": "paper",
          "url": "https://proceedings.mlr.press/v235/yuan24d.html"
        }
      ]
    },
    {
      "id": "godel-agent",
      "name": "Gödel Agent",
      "year": 2024,
      "role": "direct_self_modifying_agent",
      "reported_depth": "persistent",
      "changed_objects": [
        "agent_code",
        "agent_logic"
      ],
      "evidence_status": "reported",
      "audit_status": "pending",
      "central_limit": "Transfer across unrelated tasks, models, and improvement problems remains limited.",
      "sources": [
        {
          "type": "repository",
          "url": "https://github.com/Arvid-pku/Godel_Agent"
        },
        {
          "type": "paper",
          "url": "https://aclanthology.org/2025.acl-long.1354/"
        }
      ]
    },
    {
      "id": "adas",
      "name": "ADAS",
      "year": 2024,
      "role": "adjacent_agent_architecture_search",
      "reported_depth": "external_optimization",
      "changed_objects": [
        "agent_architecture"
      ],
      "evidence_status": "reported",
      "audit_status": "pending",
      "central_limit": "The outer designer remains fixed; persistent target improvement is not evidence that the improver improved.",
      "sources": [
        {
          "type": "repository",
          "url": "https://github.com/ShengranHu/ADAS"
        }
      ]
    },
    {
      "id": "aflow",
      "name": "AFlow",
      "year": 2024,
      "role": "adjacent_workflow_search",
      "reported_depth": "external_optimization",
      "changed_objects": [
        "agent_workflow"
      ],
      "evidence_status": "reported",
      "audit_status": "pending",